{
  "$schema": "./schema/orpheus-suite.schema.json",
  "schema_version": 1,
  "suite_id": "orpheus-suite",
  "suite_version": "0.1.0",
  "release_channel": "development",
  "manifest_revision": "2026-10-14",
  "workspace": {
    "root_environment": "ORPHEUS_SUITE_WORKSPACE",
    "default_root": "..",
    "paths_are_relative": true,
    "require_clean_worktrees_for_apply": true
  },
  "channels": {
    "development": {
      "mode": "floating",
      "branch": "main",
      "snapshot_id": null
    },
    "candidate": {
      "mode": "pinned",
      "branch": "main",
      "snapshot_id": null
    },
    "stable": {
      "mode": "pinned",
      "branch": "main",
      "snapshot_id": null
    }
  },
  "update_policy": {
    "development": "follow declared default branches; never treat a moving branch as a stable compatibility claim",
    "candidate": "create an immutable snapshot only after declared verification and acceptance gates pass",
    "stable": "promote a candidate snapshot without changing component revisions",
    "generated_artifacts": "check source, provenance, and content hashes before any mirror write",
    "consumer_pins": "update exact submodule or package pins in dependency order and review each consumer PR independently"
  },
  "coordination": {
    "system_of_record": "orpheus-sdk",
    "change_id_format": "ORP-SUITE-YYYYMMDD-NNN",
    "branch_prefix": "suite/",
    "pr_title_prefix": "suite:",
    "merge_order": [
      "shmui",
      "orpheus-sdk",
      "fourtrack",
      "freqfinder",
      "clip-composer"
    ],
    "pr_grouping": "one logical repository change per PR; coordinated changes carry the same change_id",
    "credentials": "use the configured Git credential helper for pushes and a short-lived GitHub App token or fine-grained token via environment for API calls; never store credentials in the manifest",
    "loop_prevention": "suite change IDs and workflow origin markers are required on generated PRs; generated PRs do not trigger another coordinator run"
  },
  "repositories": [
    {
      "id": "orpheus-sdk",
      "path": "orpheus-sdk",
      "remote": {
        "fetch_url": "https://github.com/boot-industries/treefall-sdk.git",
        "fetch_remote": "origin",
        "push_url": "https://github.com/boot-industries/treefall-sdk.git",
        "push_remote": "origin"
      },
      "default_branch": "main",
      "role": "shared-library",
      "source_of_truth": [
        "src/",
        "include/",
        "packages/",
        "tools/"
      ],
      "compatibility": {
        "api_line": "0.9.x",
        "stable_c_abi": "1.0",
        "shmui_juce_contract": "0.6.0"
      },
      "generated_artifacts": [
        {
          "id": "sdk-shmui-juce-package",
          "path": "packages/shmui-juce",
          "hash_type": "sha256-path-nul-content-v1",
          "exclude_paths": [
            "shmui-juce-import.json"
          ],
          "expected_sha256": "c258caee7eb1c639e2fe7aa654b926aa216d5232149aad52423f897c91167655",
          "source_repository": "shmui",
          "source_revision": "1f2c87a089d975eec1396360173da87a926835ed",
          "current_source_revision": "1f2c87a089d975eec1396360173da87a926835ed",
          "source_paths": [
            "juce/Source",
            "juce/tests",
            "juce/CMakeLists.txt",
            "juce/ImportContract.json"
          ],
          "freshness_check": "python3 tools/shmui_juce_manifest.py --check"
        }
      ],
      "verification": [
        {
          "id": "sdk-shmui-manifest",
          "cwd": "orpheus-sdk",
          "command": [
            "python3",
            "tools/shmui_juce_manifest.py",
            "--check"
          ],
          "tier": "quick",
          "platforms": [
            "macos",
            "linux"
          ],
          "required_for": [
            "candidate",
            "stable"
          ]
        },
        {
          "id": "sdk-version-contract",
          "cwd": "orpheus-sdk",
          "command": [
            "python3",
            "tools/version_contract.py",
            "--check"
          ],
          "tier": "quick",
          "platforms": [
            "macos",
            "linux"
          ],
          "required_for": [
            "candidate",
            "stable"
          ]
        },
        {
          "id": "sdk-configured-tests",
          "cwd": "orpheus-sdk",
          "command": [
            "ctest",
            "--test-dir",
            "build",
            "--output-on-failure"
          ],
          "tier": "full",
          "platforms": [
            "macos",
            "linux"
          ],
          "required_for": [
            "stable"
          ]
        }
      ]
    },
    {
      "id": "shmui",
      "path": "shmui",
      "remote": {
        "fetch_url": "https://github.com/boot-industries/shmui.git",
        "fetch_remote": "origin",
        "push_url": null,
        "push_remote": null
      },
      "default_branch": "main",
      "role": "design-system-source",
      "source_of_truth": [
        "apps/www/styles/orpheus-tokens.css",
        "juce/Source",
        "registry/"
      ],
      "compatibility": {
        "design_token_contract": "0.6.0",
        "juce_import_contract": "0.6.0"
      },
      "generated_artifacts": [
        {
          "id": "shmui-canonical-tokens",
          "path": "apps/www/styles/orpheus-tokens.css",
          "hash_type": "sha256-file-v1",
          "expected_sha256": "af404565143f6bb59b380ca10a79cd8fce5ebaf8d762730cf6f88a70f06f075c",
          "source_repository": "shmui",
          "source_revision": "1f2c87a089d975eec1396360173da87a926835ed",
          "source_paths": [
            "apps/www/styles/orpheus-tokens.css"
          ]
        }
      ],
      "verification": [
        {
          "id": "shmui-juce-freshness",
          "cwd": "shmui",
          "command": [
            "bash",
            "scripts/sync-juce.sh",
            "--check"
          ],
          "environment": {
            "SDK_ROOT": "../orpheus-sdk"
          },
          "tier": "quick",
          "platforms": [
            "macos",
            "linux"
          ],
          "required_for": [
            "candidate",
            "stable"
          ]
        },
        {
          "id": "shmui-token-contract",
          "cwd": "shmui",
          "command": [
            "pnpm",
            "--filter=www",
            "check:juce-tokens"
          ],
          "tier": "quick",
          "platforms": [
            "macos",
            "linux"
          ],
          "required_for": [
            "candidate",
            "stable"
          ]
        },
        {
          "id": "shmui-registry-contract",
          "cwd": "shmui",
          "command": [
            "pnpm",
            "--filter=www",
            "validate:registries"
          ],
          "tier": "full",
          "platforms": [
            "macos",
            "linux"
          ],
          "required_for": [
            "stable"
          ]
        }
      ]
    },
    {
      "id": "fourtrack",
      "path": "fourtrack",
      "remote": {
        "fetch_url": "https://github.com/boot-industries/fourtrack.git",
        "fetch_remote": "origin",
        "push_url": "https://github.com/boot-industries/fourtrack.git",
        "push_remote": "origin"
      },
      "default_branch": "main",
      "role": "native-recorder-application",
      "source_of_truth": [
        "src/",
        "include/",
        "apps/fourtrack-mac/"
      ],
      "compatibility": {
        "orpheus_sdk": "0.9.1",
        "shmui_contract": "0.6.0"
      },
      "dependency_pins": [
        {
          "dependency": "orpheus-sdk",
          "kind": "git-submodule",
          "path": "third_party/orpheus-sdk",
          "revision": "56a81fcdff445b43d1ba4d9b6684efbbffd11e32"
        }
      ],
      "external_pins": [
        {
          "name": "nlohmann-json",
          "kind": "git-submodule",
          "path": "third_party/json",
          "remote": "https://github.com/nlohmann/json.git",
          "revision": "9cca280a4d0ccf0c08f47a99aa71d1b0e52f8d03"
        }
      ],
      "generated_artifacts": [
        {
          "id": "fourtrack-shmui-manifest",
          "path": "apps/fourtrack-mac/Generated/Shmui/manifest.json",
          "hash_type": "sha256-file-v1",
          "expected_sha256": "86385b412bfcc28d38a8d0fbbbbd2d98d69f6a138af864644dc7d2dcd14ff3a8",
          "source_repository": "shmui",
          "source_revision": "1f2c87a089d975eec1396360173da87a926835ed",
          "current_source_revision": "1f2c87a089d975eec1396360173da87a926835ed",
          "source_paths": [
            "juce/Source",
            "apps/www/styles/orpheus-tokens.css"
          ]
        },
        {
          "id": "fourtrack-shmui-tokens",
          "path": "apps/fourtrack-mac/Generated/Shmui/OrpheusDesignTokens.swift",
          "hash_type": "sha256-file-v1",
          "expected_sha256": "f067569b9bb80f0c210b1f629e458ba1817ea4806c05bf08284bcbe4538c3592",
          "source_repository": "shmui",
          "source_revision": "1f2c87a089d975eec1396360173da87a926835ed",
          "current_source_revision": "1f2c87a089d975eec1396360173da87a926835ed",
          "source_paths": [
            "apps/www/styles/orpheus-tokens.css"
          ]
        }
      ],
      "verification": [
        {
          "id": "fourtrack-format",
          "cwd": "fourtrack",
          "command": [
            "scripts/format.sh",
            "--check"
          ],
          "tier": "quick",
          "platforms": [
            "macos",
            "linux"
          ],
          "required_for": [
            "candidate",
            "stable"
          ]
        },
        {
          "id": "fourtrack-core-tests",
          "cwd": "fourtrack",
          "command": [
            "ctest",
            "--test-dir",
            "build-mac",
            "--output-on-failure"
          ],
          "tier": "full",
          "platforms": [